{
  "schemaVersion": 1,
  "asOf": "2026-09-29",
  "sourceRevision": "05ee6bb05982289dbe00c4187b9d54cf90e2e276",
  "description": "BEACN Labs original research summaries and implementation designs. Base snapshot sourceRevision is retained; individual sources carry their own revisions and access dates. CIP-113 added 2026-09-29. Not a live registry or proof of Studio support.",
  "sources": [
    {
      "id": "cip-0001",
      "url": "https://cips.cardano.org/cip/CIP-0001",
      "rawUrl": "https://raw.githubusercontent.com/cardano-foundation/CIPs/05ee6bb05982289dbe00c4187b9d54cf90e2e276/CIP-0001/README.md",
      "sourceCommit": "05ee6bb05982289dbe00c4187b9d54cf90e2e276",
      "sha256": "6a200cc52e3695bfa45850de1799335115a2093ff1fd424434ca46a6533b8cc8",
      "accessedAt": "2026-09-07T04:17:04.715192+00:00",
      "title": "CIP-0001: CIP Process",
      "declaredStatus": "Active",
      "license": "CC-BY-4.0",
      "created": "2020-03-21",
      "attribution": "Frederic Johnson; Sebastien Guillemot; Matthias Benkort; Duncan Coutts; Michael Peyton Jones; Robert Phair",
      "sourceType": "primary-specification"
    },
    {
      "id": "cip-0008",
      "url": "https://cips.cardano.org/cip/CIP-0008",
      "rawUrl": "https://raw.githubusercontent.com/cardano-foundation/CIPs/05ee6bb05982289dbe00c4187b9d54cf90e2e276/CIP-0008/README.md",
      "sourceCommit": "05ee6bb05982289dbe00c4187b9d54cf90e2e276",
      "sha256": "9b725ead1a9a37b393f5f620ed5c0eb8617def5d8994667f5b6b8b8b8e1a6476",
      "accessedAt": "2026-09-07T04:17:04.743744+00:00",
      "title": "CIP-0008: Message Signing",
      "declaredStatus": "Active",
      "license": "CC-BY-4.0",
      "created": "2020-09-28",
      "attribution": "Sebastien Guillemot",
      "sourceType": "primary-specification"
    },
    {
      "id": "cip-0014",
      "url": "https://cips.cardano.org/cip/CIP-0014",
      "rawUrl": "https://raw.githubusercontent.com/cardano-foundation/CIPs/05ee6bb05982289dbe00c4187b9d54cf90e2e276/CIP-0014/README.md",
      "sourceCommit": "05ee6bb05982289dbe00c4187b9d54cf90e2e276",
      "sha256": "2b2a872f67a4f027b4e76498e6ddc3114521354dffa69a403418f424074123ea",
      "accessedAt": "2026-09-07T04:17:04.729409+00:00",
      "title": "CIP-0014: User-Facing Asset Fingerprint",
      "declaredStatus": "Active",
      "license": "CC-BY-4.0",
      "created": "2020-02-01",
      "attribution": "Matthias Benkort; Rodney Lorrimar",
      "sourceType": "primary-specification"
    },
    {
      "id": "cip-0019",
      "url": "https://cips.cardano.org/cip/CIP-0019",
      "rawUrl": "https://raw.githubusercontent.com/cardano-foundation/CIPs/05ee6bb05982289dbe00c4187b9d54cf90e2e276/CIP-0019/README.md",
      "sourceCommit": "05ee6bb05982289dbe00c4187b9d54cf90e2e276",
      "sha256": "9fbc8c69f261650b5ccab975fe1e291358a2e5e09088690b000013ea1cb72ce5",
      "accessedAt": "2026-09-07T04:17:04.742368+00:00",
      "title": "CIP-0019: Cardano Addresses",
      "declaredStatus": "Active",
      "license": "CC-BY-4.0",
      "created": "2020-03-25",
      "attribution": "Matthias Benkort",
      "sourceType": "primary-specification"
    },
    {
      "id": "cip-0021",
      "url": "https://cips.cardano.org/cip/CIP-0021",
      "rawUrl": "https://raw.githubusercontent.com/cardano-foundation/CIPs/05ee6bb05982289dbe00c4187b9d54cf90e2e276/CIP-0021/README.md",
      "sourceCommit": "05ee6bb05982289dbe00c4187b9d54cf90e2e276",
      "sha256": "8f9a6c420cd67fcd8ef212aba459d451709e34a9267f3a3950288e62d315185b",
      "accessedAt": "2026-09-07T04:17:04.712794+00:00",
      "title": "CIP-0021: Transaction requirements for interoperability with hardware wallets",
      "declaredStatus": "Active",
      "license": "CC-BY-4.0",
      "created": "2021-06-15",
      "attribution": "Gabriel Kerekes; Rafael Korbas; Jan Mazak",
      "sourceType": "primary-specification"
    },
    {
      "id": "cip-0025",
      "url": "https://cips.cardano.org/cip/CIP-0025",
      "rawUrl": "https://raw.githubusercontent.com/cardano-foundation/CIPs/05ee6bb05982289dbe00c4187b9d54cf90e2e276/CIP-0025/README.md",
      "sourceCommit": "05ee6bb05982289dbe00c4187b9d54cf90e2e276",
      "sha256": "cdd012a0d916e5b100c3ee702ae1b04f0f52756a4bfc4fcc585d1a10810dfea3",
      "accessedAt": "2026-09-07T04:17:04.715776+00:00",
      "title": "CIP-0025: Media Token Metadata Standard",
      "declaredStatus": "Active",
      "license": "CC-BY-4.0",
      "created": "2021-04-08",
      "attribution": "Alessandro Konrad; Smaug",
      "sourceType": "primary-specification"
    },
    {
      "id": "cip-0027",
      "url": "https://cips.cardano.org/cip/CIP-0027",
      "rawUrl": "https://raw.githubusercontent.com/cardano-foundation/CIPs/05ee6bb05982289dbe00c4187b9d54cf90e2e276/CIP-0027/README.md",
      "sourceCommit": "05ee6bb05982289dbe00c4187b9d54cf90e2e276",
      "sha256": "1771d794668f977b48477dfc83b164dc2726a4584467a83188681e5658b47407",
      "accessedAt": "2026-09-07T04:17:04.723994+00:00",
      "title": "CIP-0027: CNFT Community Royalties Standard",
      "declaredStatus": "Active",
      "license": "Apache-2.0",
      "created": "2021-08-29",
      "attribution": "Huth S0lo; TheRealAdamDean",
      "sourceType": "primary-specification"
    },
    {
      "id": "cip-0029",
      "url": "https://cips.cardano.org/cip/CIP-0029",
      "rawUrl": "https://raw.githubusercontent.com/cardano-foundation/CIPs/05ee6bb05982289dbe00c4187b9d54cf90e2e276/CIP-0029/README.md",
      "sourceCommit": "05ee6bb05982289dbe00c4187b9d54cf90e2e276",
      "sha256": "22fb4441505e7d22befeed755190bf8e4339163478f5fcf6e46fe11ed65d568b",
      "accessedAt": "2026-09-07T04:17:04.747502+00:00",
      "title": "CIP-0029: Phase-1 Monetary Scripts Serialization Formats",
      "declaredStatus": "Active",
      "license": "CC-BY-4.0",
      "created": "2020-08-17",
      "attribution": "Matthias Benkort",
      "sourceType": "primary-specification"
    },
    {
      "id": "cip-0030",
      "url": "https://cips.cardano.org/cip/CIP-0030",
      "rawUrl": "https://raw.githubusercontent.com/cardano-foundation/CIPs/05ee6bb05982289dbe00c4187b9d54cf90e2e276/CIP-0030/README.md",
      "sourceCommit": "05ee6bb05982289dbe00c4187b9d54cf90e2e276",
      "sha256": "3d16866b8f6b703cda21e5dab2c8afdfd8f83dd3f12068429a01bcc4bf315ebe",
      "accessedAt": "2026-09-07T04:17:04.827012+00:00",
      "title": "CIP-0030: Cardano dApp-Wallet Web Bridge",
      "declaredStatus": "Active",
      "license": "CC-BY-4.0",
      "created": "2021-04-29",
      "attribution": "rooooooooob",
      "sourceType": "primary-specification"
    },
    {
      "id": "cip-0031",
      "url": "https://cips.cardano.org/cip/CIP-0031",
      "rawUrl": "https://raw.githubusercontent.com/cardano-foundation/CIPs/05ee6bb05982289dbe00c4187b9d54cf90e2e276/CIP-0031/README.md",
      "sourceCommit": "05ee6bb05982289dbe00c4187b9d54cf90e2e276",
      "sha256": "74a00ee439372cc538e7f458d81555eb850067b992fdf5c7fba121549c4392d8",
      "accessedAt": "2026-09-07T04:17:04.849205+00:00",
      "title": "CIP-0031: Reference inputs",
      "declaredStatus": "Active",
      "license": "CC-BY-4.0",
      "created": "2021-11-29",
      "attribution": "Michael Peyton Jones",
      "sourceType": "primary-specification"
    },
    {
      "id": "cip-0032",
      "url": "https://cips.cardano.org/cip/CIP-0032",
      "rawUrl": "https://raw.githubusercontent.com/cardano-foundation/CIPs/05ee6bb05982289dbe00c4187b9d54cf90e2e276/CIP-0032/README.md",
      "sourceCommit": "05ee6bb05982289dbe00c4187b9d54cf90e2e276",
      "sha256": "d3ecb3b6f7143f538b484b699a2508380c94c0d393e602a77ac0adf9045aa32e",
      "accessedAt": "2026-09-07T04:17:04.830315+00:00",
      "title": "CIP-0032: Inline datums",
      "declaredStatus": "Active",
      "license": "CC-BY-4.0",
      "created": "2021-11-29",
      "attribution": "Michael Peyton Jones",
      "sourceType": "primary-specification"
    },
    {
      "id": "cip-0033",
      "url": "https://cips.cardano.org/cip/CIP-0033",
      "rawUrl": "https://raw.githubusercontent.com/cardano-foundation/CIPs/05ee6bb05982289dbe00c4187b9d54cf90e2e276/CIP-0033/README.md",
      "sourceCommit": "05ee6bb05982289dbe00c4187b9d54cf90e2e276",
      "sha256": "4d3d4cd1500ff76000e6ccf55ebe7ab9632fe9dc1fab172f94298ee2f24b5dbb",
      "accessedAt": "2026-09-07T04:17:04.828078+00:00",
      "title": "CIP-0033: Reference scripts",
      "declaredStatus": "Active",
      "license": "CC-BY-4.0",
      "created": "2021-11-29",
      "attribution": "Michael Peyton Jones",
      "sourceType": "primary-specification"
    },
    {
      "id": "cip-0040",
      "url": "https://cips.cardano.org/cip/CIP-0040",
      "rawUrl": "https://raw.githubusercontent.com/cardano-foundation/CIPs/05ee6bb05982289dbe00c4187b9d54cf90e2e276/CIP-0040/README.md",
      "sourceCommit": "05ee6bb05982289dbe00c4187b9d54cf90e2e276",
      "sha256": "8b2a730fd2c9a6e66465f781fd692ba5dc91f8742054b090969bf74208ec9e10",
      "accessedAt": "2026-09-07T04:17:04.835649+00:00",
      "title": "CIP-0040: Collateral Output",
      "declaredStatus": "Active",
      "license": "CC-BY-4.0",
      "created": "2022-02-10",
      "attribution": "Sebastien Guillemot; Jared Corduan; Andre Knispel",
      "sourceType": "primary-specification"
    },
    {
      "id": "cip-0054",
      "url": "https://cips.cardano.org/cip/CIP-0054",
      "rawUrl": "https://raw.githubusercontent.com/cardano-foundation/CIPs/05ee6bb05982289dbe00c4187b9d54cf90e2e276/CIP-0054/README.md",
      "sourceCommit": "05ee6bb05982289dbe00c4187b9d54cf90e2e276",
      "sha256": "6b7abd2d2ba85ece0ab8cc498bb620e97ad483e3a492f569a5f019de760b0b62",
      "accessedAt": "2026-09-07T04:17:04.845437+00:00",
      "title": "CIP-0054: Cardano Smart NFTs",
      "declaredStatus": "Proposed",
      "license": "CC-BY-4.0",
      "created": "2022-05-18",
      "attribution": "Kieran Simkin",
      "sourceType": "primary-specification"
    },
    {
      "id": "cip-0057",